{
  "$schema": "./versions.schema.json",
  "manifest_version": "0.1.0-dev",
  "released": null,
  "channel": "dev",
  "kernel": {
    "wsl_kernel_tag": "TBD — set by kernel CI from microsoft/WSL2-Linux-Kernel release tag",
    "artifact": "bzImage-windroid-<tag>",
    "sha256": null,
    "config_fragment": "kernel/windroid.fragment"
  },
  "rootfs": {
    "build_id": null,
    "base": "TBD — distro/version chosen in Phase 1",
    "flavours": {
      "vanilla": {
        "artifact": "windroid-rootfs-vanilla-<build_id>.tar.gz",
        "sha256": null,
        "public": true
      },
      "gapps": {
        "artifact": null,
        "sha256": null,
        "public": false,
        "note": "Never redistributed (ADR-004). Built user-side by install.ps1 -Gapps."
      }
    }
  },
  "waydroid": {
    "version": "1.6.3 (snapshot 2026-08-30; release CI pins the built deb version)",
    "android_version": "13 (LineageOS 20, current OTA channel as of 2026-08-30)",
    "system_image_sha256": null,
    "vendor_image_sha256": null,
    "note": "sha256s filled by rootfs CI from the preseed manifest"
  },
  "waydroid_script": {
    "repo": "https://github.com/casualsnek/waydroid_script",
    "commit": "d5289cf",
    "note": "Upstream dormant since 2026-01 (zero releases; issue #282 asks if abandoned) — pinned per Risk R3; fork if it breaks. Known doc trap: README says 'main.py google', real subcommand is 'certified'."
  },
  "installer": {
    "min_windows_build": null,
    "min_wsl_version": null
  }
}
